{
  "lockVersion": "browser-host-lock-v1.0",
  "bundle": {
    "path": "browser/relationship-presentation-core.bundle.mjs",
    "sha256": "8a785265675422e0b37783787341b7f3e012a9b407efd64e927793864ed39871",
    "sriIntegrity": "sha384-G68ZqaXgF5mtWSt2LF1cDEYoy9fzTs7v9PCy4eHjqSJUXPYnzfha/e4BFshPPbTu"
  },
  "bundler": {
    "package": "esbuild",
    "version": "0.28.2",
    "integrity": "sha512-HKVLS8dvII+xoKW9kmqxbRKrnWEXfJJr/FZhhJmiqIB0e053QNYFqOBouTMO/k5sID4MvCiUCvv8b9M4h32wIA=="
  },
  "compiler": {
    "name": "relationship-presentation-poc",
    "version": "1.0.0"
  },
  "engineBaselines": [
    {
      "engine": "Chromium",
      "version": "151.0.7922.34"
    },
    {
      "engine": "Firefox",
      "version": "153.0"
    },
    {
      "engine": "WebKit",
      "version": "26.5"
    }
  ]
}
